Title,Responsibility,Associated Places,Publication,Manufacture,Distribution,Date,Approximate Date,Copyright,Edition/Imprint,Pagination,Height,Width,Denomination,Notation,Language,Content,1850-1925,After 1925,Before 1850,Broadside,Confederate Imprint,Convention Gospel,Denominational Publication,Dispersed Harmony,Distributor in South,Ethnographic,Female Author/Publisher,Fraternal Society,Gospel,Liturgical/Devotional Content,Missionary Use,Native Use,Non-White,Occasional,Out-of-Country Publisher,Out-of-Region Publisher,Revival Use,Scientific Music,Singing School Use,Still in Use,Sheet Music,Spirituals,Sunday School Use,Tract Society Publication,Attestations,Source for Record,Emory Holdings,MTSU Holdings,SBTS Holdings,UK Holdings,Notes
Sabbath morning service,"Goldstein, Morris","Cincinnati, OH",Willis Music Co.,,,1917,Y,1917,,52,35,,Jewish,Round,Hebrew; English,Sacred,Y,,,,,,,,,,,,,,,,Y,,,,,Y,,,,,,,"Hebrew Union College-JIR, Cincinnati",OCLC,,,,,
"Songs of help : for the Sunday school, evangelistic and church services","Black, James M.","Cincinnati, OH",Abingdon Press,,,1917,Y,1917,,approx. 200,21,,Methodist (MEC),Round,English,Sacred,Y,,,,,,Y,,,,,,,,Y,,,,,,,,,,,,Y,,Emory,Emory,Y,,,,
Synagogical music no. 3 : Sabbath morning service,"Goldstein, Morris","Cincinnati, OH",Willis Music Co.,,,1917,Y,1917,,52,35,,Jewish (Reform),Round,Hebrew; English,Sacred,Y,,,,,,,,,,,,,,,,Y,,,,,Y,,,,,,,"Hebrew Union College-JIR, Cincinnati; Jewish Theological Seminary of America",OCLC,,,,,
Synagogical music no. 8: miscellaneous,"Goldstein, Morris; Philipson, David; Durst, Sidney C.","Cincinnati, OH",Willis Music Co.,,,1917,Y,1917,,102,35,,Jewish (Reform),Round,Hebrew; English,Sacred,Y,,,,,,,,,,,,,,,,Y,Y,,,,Y,,,,,,,"Hebrew Union College-JIR, Cincinnati; Jewish Theological Seminary of America",OCLC,,,,,
Synagogical music no. 9: evening and morning service for the New Year and the Day of Atonement,"Goldstein, Morris","Cincinnati, OH",Willis Music Co.,,,1917,Y,1917,,218,35,,Jewish (Reform),Round,Hebrew; English,Sacred,Y,,,,,,,,,,,,,,,,Y,,,,,Y,,,,,,,SBTS; University of Wisconsin-Milwaukee; Hebrew Union College-JIR,OCLC,,,Y,,
"Walk together, children : triumphant Negro march song","Johnson, J. Rosamond","Boston, MA",O. Ditson,,,1917,Y,1917,,5,35,,,Round,English,Sacred,Y,,,,,,,,,,,,,,,,Y,,,Y,,,,,,,,,Carnegie Library of Pittsburgh; Library of Congress,OCLC,,,,,
Chant : Nobody knows de trouble I've seen,"White, Clarence Cameron","Clarkesville, TN; New York, NY",C. Fischer,,,1918,Y,1918,,unpaged,31,,,Round,English,Sacred,Y,,,,,,,,,,,,,,,,Y,,,Y,,Y,,,,,,,UK,UK,,,,Y,Arrangement for violin and piano
Hymn of freedom : for quartet or chorus of men's voices with piano accompaniment (ab libitum),"Burlin, Natalie Curtis","St. Helena Island, SC; New York, NY",G. Schirmer,,,1918,Y,1918,,8,27,,,Round,English,Sacred,Y,,,,,,,,,,Y,,,,,,Y,,,Y,,Y,,,Y,Y,,,Wake Forest University;,OCLC,,,,,
"Hymn of freedom : for sextet or chorus of mixed voices, with piano accompaniment (ad libitum)","Burlin, Natalie Curtis","St. Helena Island, SC; New York, NY",G. Schirmer,,,1918,Y,1918,,8,27,,,Round,English,Sacred,Y,,,,,,,,,,Y,,,,,,Y,,,Y,,Y,,,Y,Y,,,Tuskegee University; University of Chicago; Library of Congress,OCLC,,,,,
Negro folk-songs,"Burlin, Natalie Curtis","New York, NY",G. Schirmer,,,1918,Y,1918,,4 vols.,28,,,Round,English,Sacred,Y,,,,,,,,,,Y,,,,,,Y,,,,,Y,,,,Y,,,MTSU,MTSU (OPAC),,Y,,,
Negro melodies,"Maveety, Patrick J.; Penn, I. Garland","Chicago, IL",Rodeheaver Co.,,,1919,,1918,,4 nos.,23,,,Round,English,Sacred,Y,,,,,,,,,,,,,,,,Y,,,Y,,Y?,,,,Y,,,Chicago Public Library; University of Alabama,OCLC,,,,,"Apparently an abbreviated version of the Rodeheaver ""Plantation Melodies"""
Negro spirituals of the South,"Jacobs-Bond, Carrie; Gillen, Mary; Chalifoux, Oliver","Hollywood, CA; Boston, MA",Carrie Jacobs-Bond & Son,,Boston Music Co.,1918,Y,1918,,39,30,,,Round,English,Sacred,Y,,,,,,,,,Y,Y,,,,,,Y,,,Y,,,,,,Y,,,Metropolitan Library System; Southwestern Baptist Theological Seminary; Los Angeles Public Library; Winthrop University; Buffalo and Erie County Public Library; University of North Carolina at Chapel Hill; New York State Library; Newark Public Library; Brown University,OCLC,,,,,
Old melodies of the South,"Jacobs-Bond, Carrie; Gillen, Mary; Chalifoux, Oliver","Chicago, IL",Carrie Jacobs-Bond & Son,,,1918,Y,1918,,39,31,,,Round,English,Sacred,Y,,,,,,,,,,Y,,,,,,Y,,,Y,,Y,,,,Y,,,"Brigham Young University; Chicago Public Library; Indiana University; Tulane University; University of Alabama at Birmingham; Library of Michigan; Auburn University; Mount Allison University; Florida State University; Whitworth University; Stanford University; University of California, Davis; University of South Carolina; University of British Columbia; New-York Historical Society; Brown University",OCLC,,,,,
Plantation melodies,"Rodeheaver, Homer A.","Chicago, IL; Philadelphia, PA",Rodeheaver Co.,,,1918,Y,1918,,48,26,,,Round,English,Sacred,Y,,,,,,,,,,,,Y,,,,Y,,,,,,,,,Y,,,MTSU; SBTS,MTSU (OPAC),,Y,Y,,
"Popular hymnal, The : old standard hymns and popular gospel songs for use in all departments of church, Sunday school and young people's work","Coleman, Robert H.","Dallas, TX",Robert H. Coleman,,,1918,Y,1918,Round note ed.,352,21,,,Round,English,Sacred,Y,,,,,,,,,,,,Y,,,,,,,,Y,,,,,,Y,,MTSU; SBTS; Emory,MTSU (OPAC),Y,Y,Y,,At least Emory copy is round note ed.
"Revival melodies : a choice selection of songs, new and old, for church, revival and young people's services, where special songs are needed","Thomas, J. E.; Allphin, N. W.","Ft. Worth, TX",Quartet Music Co.,,,1918,,1918,,213 nos.,20,,,Round,English,Sacred,Y,,,,,,,,,,,,,,,,,,,,Y,,,,,,,,Emory,Emory,Y,,,,
"Revival power : for the church, Sunday-school, the revival, young people's meetings, conventions and the home","Smith, Woodie Washington; English, Joe W.","Fort Worth, TX",Woodie W. Smith Co.,,,1918,Y,1918,,348 nos.,20,,,Round,English,Sacred,Y,,,,,,,,,,,,,,,,,,,,Y,,,,,,Y,,SBTS; MTSU?,SBTS,,Y,Y,,
"Rodeheaver's plantation melodies : a collection of modern, popular and old-time negro songs of the Southland","Rodeheaver, Homer A.; Ackley, B. D.","Chicago, IL",Rodeheaver Co.,,,1918,Y,1918,,32,20,,,Round,English,Sacred,Y,,,,,,,,,,,,,,,,Y,,,Y,,Y?,,,,Y,,,University of Illinois at Urbana Champaign; University of South Florida; University of South Florida St. Petersburg; Brown University?,OCLC,,,,,"Brown record gives ""Rodeheaver,"" not ""Rodeheaver's"""
Weeping Mary : anthem for mixed voices,"Dett, R. Nathaniel","New York, NY",J. Fischer & Bro.,,,1918,Y,1918,,8,27,,,Round,English,Sacred,Y,,,,,,,,,,,,,,,,Y,,,Y,,Y,,,,,,,University of North Carolina at Chapel Hill; University of Pittsburgh; Library of Congress; Florida Memorial University; Westminster Choir College of Rider University,OCLC,,,,,
Hampton series Negro folk-songs,"Curtis-Burlin, Natalie","Hampton, VA; New York, NY",G. Schirmer,,,1919,,1918-19,,"42, 44, 40, 50",26,,,Round,English,Mixed?,Y,,,,,,,,,Y,Y,,,,,,Y,,,,,Y?,,,,,,,Emory,Emory,Y,,,,
"Chariot jubilee, The : motet for tenor solo and chorus of mixed voices [with] accompaniment of organ (piano) or orchestra.","Dett, R. Nathaniel","Cincinnati, OH",J. Church,,,1919,Y,1919,,31?,?,,,Round,English,Sacred,Y,,,,,,,,,,,,,,,,Y,,,,,Y,,,,Y,,,University of Cincinnati; DePauw University; Brown University; Pacific Union College,OCLC,,,,,
Done paid my vow to the Lord : Negro spiritual for baritone or contralto solo and chorus of women's voices with accompaniment,"Dett, R. Nathaniel","Cincinnati, OH",J. Church,,,1919,Y,1919,,7,28,,,Round,English,Sacred,Y,,,,,,,,,,,,,,,,Y,,,,,Y,,,,Y,,,Oberlin College; Library of Congress,OCLC,,,,,
Follow me : Negro spiritual : from the collection of Catherine Fields-Gay,"Dett, R. Nathaniel; Fields-Gay, Catherine","Cincinnati, OH",John Church,,,1919,Y,1919,,8,31,,,Round,English,Sacred,Y,,,,,,,,,Y,Y,,,,,,Y,,,Y,,Y,,,,,,,University of Pennsylvania,OCLC,,,,,
Hampton song,?,"Hampton, VA?",Hampton Normal and Agricultural Institute,,,1919,Y,1919,,3,22,,,Round,English,?,Y,,,,,,,,,,,,,,,,Y,,,,,,,,Y,,,,University of Virginia,OCLC,,,,,No clue if this is religious or not
"He's jus' de same to-day : from Calhoun, Lowndes Co., Alabama","Burleigh, Harry T.","New York, NY; Calhoun, AL",G. Ricordi,,,1919,Y,1919,,7,33,,,Round,English,Sacred,Y,,,,,,,,,Y,,,,,,,Y,,,Y,,Y,,,,Y,,,SBTS,SBTS,,,Y,,
Hymnal of the Baltimore Conference on Christian Fundamentals,"Alexander, Charles M.","Baltimore, MD",The Conference,,,1919,Y,1919,,73 nos.,20,,,Round,English,Sacred,Y,,,,,,Y?,,,,,,,,,,,,,,,,,,,,,,Emory,Emory,Y,,,,
I'm so glad trouble don't last alway : Negro spiritual : from the collection of R.N.D.,"Dett, R. Nathaniel","Cincinnati, OH",J. Church,,,1919,Y,1919,,5,31,,,Round,English,Sacred,Y,,,,,,,,,,,,,,,,Y,,,,,Y,,,,Y,,,Duke University; Oakland University; University of Pennsylvania,OCLC,,,,,
Sacred songs for little children : for every-day in the week,"Gaynor, Jessie L.","Cincinnati, OH",J. Church,,,1919,Y,1919,,102,21,,,Round,English,Sacred,Y,,,,,,,,,,Y,,,,,,,,,,,,,,,,Y,,Emory,Emory,Y,,,,
Things up yonder white as snow : Negro spiritual for voice and piano,"Reddick, William","New York, NY",Huntzinger & Dilworth,,,1919,Y,1919,,5,30,,,Round,English,Sacred,Y,,,,,,,,,,,,,,,,Y,,,Y,,Y,,,,Y,,,UK,UK,,,,Y,"Composer from Paducah, KY; have not been able to suss out whether he was black"
Forever thine : a song,"Dawson, William L.","Tuskegee, AL",Wm. L. Dawson,,,1920,Y,1920,,5,35,,,Round,English,?,Y,,,,,,,,,,,,,,,,Y,,,,,,,,Y,,,,University of Pennsylvania,OCLC,,,,,No clue if this is secular or sacred
"My Lord, taker me home [sic?]","Clark, F. A.; Rhynes, Myles Andrew Julius","Cleveland, OH",M. A. J. Rhynes,,,1920,Y,1920,,3,32,,,Round,English,Sacred,Y,,,,,,,,,,,,Y,,,,Y,,,Y,,,,,Y,,,,University of Pennsylvania,OCLC,,,,,
New jubilee songs : as sung by the Fisk Jubilee Singers of Fisk University,"Work, Frederick Jerome","Nashville, TN",Fisk University,,,1920,Y,1920,,48,23,,,Round,English,Sacred,Y,,,,,,,,,,,,,,,,Y,,,,,Y?,,,,Y,,,Western Reserve Historical Society,OCLC,,,,,
Nobody knows de trouble I've seen : Negro spiritual,"White, Clarence Cameron","New York, NY",Carl Fischer,,,1920,Y,1920,,5,31,,,Round,English,Sacred,Y,,,,,,,,,,,,,,,,Y,,,Y,,Y,,,,,,,University of South Florida; Sarah Lawrence College; University of Colorado-Boulder,OCLC,,,,,
Bear de burden : Negro spiritual,"White, Clarence Cameron","New York, NY",C. Fischer,,,1921,Y,1921,,5,31,,,Round,English,Sacred,Y,,,,,,,,,,,,,,,,Y,,,Y,,Y,,,,,,,Tuskegee Institute; Lee County Library; University of Pennsylvania,OCLC,,,,,
"Don't be weary, traveler : motet on a Negro folk song motif : for six-part unaccompanied chorus of mixed voices","Dett, R. Nathaniel","Cincinnati, OH",J. Church,,,1921,Y,1921,,17,28,,,Round,English,Sacred,Y,,,,,,,,,,,,,,,,Y,,,Y,,Y,,,,,,,Library of Congress; University of Pennsylvania,OCLC,,,,,
Down by de ribber side : Negro spiritual,"White, Clarence Cameron","New York, NY",C. Fischer,,,1921,Y,1921,,5,31,,,Round,English,Sacred,Y,,,,,,,,,,,,,,,,Y,,,Y,,Y,,,,,,,University of Pennsylvania; Temple University,OCLC,,,,,
"Gospel pearls, edited and compiled for special use in the sunday school, church, evangelistic meetings, conventions and all religious services by the Music Committee of the Sunday School Publishing Board",?,"Nashville, TN; Washington, DC","Sunday School Publishing Board, National Baptist Convention, U.S.A.",,,1921,Y,1921,,158,20,,Baptist (NBC),Round,English,Sacred,Y,,,,,,Y,,,,,,,,Y,,Y,,,,Y,,,,,,Y,,Emory; MTSU?,Emory,Y,Y,,,Emory has five non-identical imprints; not clear if all are round-note ed.; MTSU lacks any notation info.
"Gospel train, De : Git on bo'd lit'l children : Negro spiritual","Burleigh, H. T.","London; New York, NY",Ricordi,,,1921,Y,1921,,5,31,,,Round,English,Sacred,Y,,,,,,,,,,,,,,,,Y,,Y,Y,,Y,,,,Y,,,UK,UK,,,,Y,
"Great songs of the church : a comprehensive collection of Psalms, hymns, and spiritual songs of the first rank, suitable for all services of the church, alphabetically arranged","Jorgenson, E. L.","Louisville, KY",Word and Work,,,1921,Y,1921,,400 nos.,21,,,Round,English,Sacred,Y,,,,,,,,,,,,,,,,,,,,,,,,,,,,SBTS; Emory,SBTS,Y,,Y,,
"Himnario Adventista, El : para uso en el culto divino","Maxwell, Edgar Lindsay","Mountain View, CA",Pacific Press Pub. Assn.,,,1921,Y,1921,,318,21,,Adventist (Seventh-Day),Round,Spanish,Sacred,Y,,,,,,Y,,,,,,,,,,Y?,,,Y,,,,,,,,,Southwestern Adventist University; Southern Adventist University; Andrews University; Union College; Southwestern Baptist Theological Seminary; La Sierra University; Point Loma Nazarene University Library; Pacific Union College,OCLC,,,,,
Himnos de gloria,"Ball, H. C.","Springfield, MO",Editorial Vida,,,1921,Y,1921,,239,20,,,Round,Spanish,Sacred,Y,,,,,,,,,,,,Y,,,,Y?,,,,,,,,,,,,Samford University Library; Concordia Theological Seminary; Grace College and Seminary Library; Catholic Theological Union; Concordia University Chicago; Seton Hall University; Abilene Christian University; Pepperdine University; Vanguard University,OCLC,,,,,
I'm goin' home : Negro spiritual,"White, Clarence Cameron","New York, NY",C. Fischer,,,1921,Y,1921,,5,31,,,Round,English,Sacred,Y,,,,,,,,,,,,,,,,Y,,,Y,,Y,,,,,,,University of Pennsylvania,OCLC,,,,,
"Kingdom songs : the choicest hymns and gospel songs of all the earth, for general use in church services, Sunday schools, and young people's meetings","Reynolds, I. E.; Coleman, Robert H.","Nashville, TN",Sunday School Board of the Southern Baptist Convention,,,1921,Y,1921,Round note ed.,320,21,,Baptist (SBC),Round,English,Sacred,Y,,,,,,Y,,,,,,,,,,,,,,,,,,,,Y,,SBTS; Emory,SBTS,Y,,Y,,
Lift ev'ry voice and sing,"Johnson, J. Rosamond; Johnson, James Weldon","New York, NY; Melville, NY",E. B. Marks; Belwin Mills,,,1921,Y,1921,,4,31,,,Round,English,Sacred,Y,,,,,,,,,,,,,,,,Y,,,Y,,,,,,,,Y,SBTS; Marshall University; Howard University; Houston Public Library; New York Public Library; Temple University,OCLC,,,Y,,
"Rough rocky road, The : I'm most done travelling : Negro spiritual","Handy, W. C.","New York, NY",Handy Bros. Music,,,1921,Y,1921,,5,32,,,Round,English,Sacred,Y,,,,,,,,,,,,,,,,Y,,,Y,,Y,,,,,,,University of Pennsylvania; Ithaca College,OCLC,,,,,
Waves of glory no. two,"Kirkpatrick, W. J.; Wallace, D. L.; Kinne, C. J.","Kansas City, MO","The Nazarene Publishing House (Kansas City, MO)",,,1921,Y,1921,,420,21,15,Nazarene,Round,English,Sacred,Y,,,,,,Y,,,,Y,,Y,,,,,,,,,,,,,,,,KUK (B6 uncataloged Lair); SBTS; MTSU?,Lair collection,,Y,Y,Y,
"World wide revival songs : for the church, Sunday school and evangelistic meetings, no. 2","Garth, James G.; Fisher, Albert C.","Siloam Springs, AR",Federation Pub. Co.,,,1921,Y,1921,,280,21,,,Round,English,Sacred,Y,,,,,,,,,,,Y,Y,,,,,,,,Y,,,,,,,,"MTSU, UK",MTSU (OPAC),,Y,,Y,For International Federation of Christian Workers
When my thoughts are thoughts of good,"Ernestinoff, Alexander; Robinson, Josephine","Indianapolis, IN",Carlin Music Co.,,,1922,Y,1922,,5,31,,,Round,English,?,Y,,,,,,,,,,Y,,,,,,Y,,,Y,,,,,Y,,,,Indiana State Library; the Indianapolis Public Library,OCLC,,,,,
All the world shall come to praise Thee : mediaeval Hebrew piyut,"Lewandowski, Louis; Zangwill, Israel; Cohon, A. Irma","Cincinnati, OH?",A. Irma Cohon,,,1923,Y,1923,,6,26,,Jewish,Round,Hebrew; English,Sacred,Y,,,,,,,,,Y?,Y,,,,,,Y,,,,,Y,,,Y,,,,"Hebrew Union College-JIR, Cincinnati",OCLC,,,,,
"Chapel hymn book, The : a collection of hymns and sacred songs, patriotic songs, popular ballads, and responsive readings for use in the chapel services of educational institutions","Hill, John L.","Nashville, TN",Sunday School Board of the Southern Baptist Convention,,,1923,Y,1923,,unpaged,22,,Baptist (SBC),Round,English,Mixed,Y,,,,,,Y,,,,,,,,,,,,,,,,,,,,,,Samford University Library; Union University; Southeastern Baptist Theological Seminary; Denison University; Ouachita Baptist University; University of Missouri-Kansas City; Southwestern Baptist Theological Seminary; Graduate Theological Union,OCLC,,,,,
Hosannas : a superior collection of gospel songs for evangelistic meetings and general use,"Coleman, Robert H.; Beazley, Samuel W.; Ramsey, William J.","Dallas, TX",Robert H. Coleman,,,1923,Y,1923,,158,20,,,Round,English,Sacred,Y,,,,,,,,,,,,Y,,Y,,,,,,,,,,,,,,SBTS; Emory; MTSU?,SBTS,Y,Y,Y,,Printed in round notes only
Listen to the lambs : A religious characteristic in the form of an anthem for chorus of women's voices with soprano solo,"Dett, R. Nathaniel; Harris, Victor","New York, NY?",Schirmer,,,1923,Y,1923,,8,27,,,Round,English,Sacred,Y,,,,,,,,,,,,,,,,Y,,,Y,,Y,,,,,,,Brigham Young University; Washington University in St. Louis; Westminster Choir College of Rider University; Southwestern Baptist Theological Seminary; Bangor Public Library; University of Southern California,OCLC,,,,,
Oh! The land I am bound for : Negro folk song derivative : Negro traditional,"Dett, R. Nathaniel","Cincinnati, OH",John Church,,,1923,Y,1923,,5,31,,,Round,English,Sacred,Y,,,,,,,,,,,,,,,,Y,,,Y,,Y,,,,,,,University of Pennsylvania; Brown University,OCLC,,,,,
Poor me : Negro folk song derivative,"Dett, R. Nathaniel; Anderson, Marian","Cincinnati, OH",John Church,,,1923,Y,1923,,5,31,,,Round,English,Sacred,Y,,,,,,,,,,Y,,,,,,Y,,,,,Y,,,,,,,"College of Charleston; University of Pennsylvania; University of North Texas; Trinity University, Coates",OCLC,,,,,
Zion hallelujah : Negro folk song derivative : from the collection of R.N.D.,"Dett, R. Nathaniel; Baytop, Miss","Cincinnati, OH",John Church Co.,,,1923,Y,1923,,5,31,,,Round,English,Sacred,Y,,,,,,,,,Y,Y,,,,,,Y,,,,,Y,,,,,,,Duke University; University of Pennsylvania,OCLC,,,,,
Christian hymnal,"Martin, W. S.; Mosley, T. B.; Sturgis, J. E.","Cincinnati, OH",Standard Publishing Co.,,,1924,Y,1924,,475,23,,,Round,English,Sacred,Y,,,,,,,,,,,,,Y,,,,,,,,,,,,,,,Emory,Emory,Y,,,,
"Collection of 25 selected famous Negro spirituals, A","Frey, Hugo","New York, NY",Robbins Music,,,1924,Y,1924,,47,31,,,Round,English,Sacred,Y,,,,,,,,,,,,Y,,,,Y,,,,,,,,,Y,,,MTSU,MTSU (OPAC),,Y,,,Local catalog lists 1952 reprint--necessary to confirm that OPAC listing is actually for 1924
Fifty-eight spirituals for choral use,"Dann, Hollis; Loomis, Harvey Worthington","Boston, MA",C. C. Birchard,,,1924,Y,1924,,61,28,,,Round,English,Sacred,Y,,,,,,,,,,,,,,,,Y?,,,Y,,Y,,,,Y,,,UK,UK,,,,Y,Dann was also white
"Man goin' roun' takin' names, A : Negro folk song derivative : from the singing of Captain Walter R. Brown, Hampton Institute","Dett, R. Nathaniel; Brown, Walter R.","Philadelphia, PA; Hampton, VA",John Church,,T. Presser,1924,Y,1924,,5,32,,,Round,English,Sacred,Y,,,,,,,,,Y,,,,,,,Y,,,Y,,Y,,,,,,,University of Pennsylvania,OCLC,,,,,
Aframerican hymn : Ethiopia stretches forth her hands unto thee,"Handy, W. C.","New York, NY",W. C. Handy,,,1925,Y,1925,,5,27,,,Round,English,Sacred,Y,,,,,,,,,,,,,,,,Y,,,,,Y?,,,Y,,,,MTSU,MTSU (OPAC),,Y,,,
"Aframerican hymn : from ""Hail to the spirit of freedom""","Handy, W. C.","New York, NY",Handy Music Publishers,,,1925,Y,1925,,parts,28,,,Round,English,Sacred,Y,,,,,,,,,,,,,,,,Y,,,Y,,Y,,,,,,,Yale University,OCLC,,,,,
"Book of American Negro spirituals, The","Johnson, James Weldon; Johnson, J. Rosamond; Brown, Lawrence","Jacksonville, FL; New York, NY",Viking Press,,,1925,Y,1925,,187,26,,,Round,English,Sacred,Y,,,,,,,,,,,,,,,,Y,,,Y,,Y?,,,,Y,,,UK; Emory; SBTS,UK,Y,,Y,Y,Several Emory copies from Dawson Coll.
"Christian praise : edited and compiled for use in Sunday schools, churches, evangelistic meetings, singing conventions and all religious services","Patton, J. D.","Birmingham, AL",J. D. Patton Music,,,1925,Y,1925,,172 nos.,20,,,Round,English,Sacred,Y,,,,,Y,,,,,,,,,Y,,,,,,,,,,,,Y,,SBTS,SBTS,,,Y,,
"Excell hymnal, The : for the church and Sunday school : church hymns, Sunday school songs, responsive readings, solos and choruses","Sewell, Hamp; Excell, E. O. Hackleman, W. E. M.","Chicago, IL",E. O. Excell,,,1925,Y,1925,,288,21,,,Round,English,Sacred,Y,,,,,,,,,,,,Y,,,,,,,Y,,,,,,,,,MTSU,MTSU (OPAC),,Y,,,
Faith inspiring songs,"Sturgis, J. E.","Cincinnati, OH; Australia?",Standard Publishing Co.,,,1925,Y,1925,,128,20,,,Round,English,Sacred,Y,,,,,,,,,,,,Y,,,,,,Y?,,,,,,,,,,MTSU; Emory,MTSU (OPAC),Y,Y,,,"MTSU copy is ""Special Australian edition for the Vawter Mission Party""; no such note on Emory ed. or MTSU local catalog"
"Home gospel songs : a collection of gospel songs for church, Sunday school, evangelistic meetings and all religious gatherings","Dennis, J. W.; Gilbert, H. A.","Tipton, OK",Tipton Orphan's Home,,,1925,Y,1925,,302 nos.,20,,,Round,English,Sacred,Y,,,,,,,,,,,,,,,,,,,,Y,,,,,,Y,,Emory,Emory,Y,,,,
"Hymns of praise, number two : for the church and Sunday school","Kingsbury, F. G.; Tuttle, Wallace","St. Louis, MO",Christian Board of Publication,,,1925,Y,1925,Bethany ed.,316,21,,,Round,English,Sacred,Y,,,,,,,,,,,,,,,,,,,,,,,,,,Y,,UK; MTSU?,UK,,Y,,Y,
I'm drinking from a fountain (that never runs dry) : spiritual anthem,"Handy, W. C.","New York, NY",Handy Bros. Music,,,1925,Y,1925,,6,27,,,Round,English,Sacred,Y,,,,,,,,,,,,,,,,Y,,,Y,,Y,,,,,,,"University of Nevada, Las Vegas",OCLC,,,,,
King Jesus is a-listening : Negro folk-song,"Dawson, William L.",?,H. T. FitzSimmons,,,1925,Y,1925,,6,26,,,Round,English,Sacred,Y,,,,,,,,,,,,,,,,Y,,,,,Y,,,,,,,SBTS; Samford University; Tulane University; University of Pittsburgh; Chicago Public Library; North Park University; Westminster Choir College; Southwestern Baptist Theological Seminary; Trinity University,OCLC,,,Y,,
"Mellows, a chronicle of unknown singers","Kennedy, R. Emmet","LA; New York, NY",Albert and Charles Boni,,,1925,Y,1925,,183,31,,,Round,English,Mixed,Y,,,,,,,,,Y,,,,,,,Y,,,,,,,,,Y,,,MTSU; Emory; SBTS; North Carolina State University,MTSU (OPAC),Y,Y,Y,,
"New songs of the old faith : no. 1, for the promotion of the full gospel of Christ and Christian zeal in all departments of the church","Lillenas, Haldor; Petticord, E. W.","Kansas City, MO",Lillenas Pub. Co.,,,1925,,1925,,175 nos.,20,,Nazarene,Round,English,Sacred,Y,,,,,Y,,,,,,,Y,,,,,,,,,,,,,,,,UK,UK,,,,Y,
"Realization song book, The","Mills, H. Edward","Portland, OR",Prospero Press,,,1925,Y,1925,,92,23,,New Thought,Round,English,Sacred,Y,,,,,,,,,,,,,,,,,,,Y,,,,,,,,,UK,UK,,,,Y,"For Realization League, Portland, OR"
"Saint Helena Island spirituals; recorded and transcribed at Penn Normal, Industrial and Agricultural School, St. Helena Island, Beaufort County, South Carolina","Ballanta-Taylor, Nicholas George Julius","Saint Helena Island, SC; New York, NY",G. Schirmer,,,1925,Y,1925,,93,27,,,Round,English,Sacred,Y,,,,,,,,,Y,,,,,,,Y,,,Y,,,,,,Y,,,MTSU; Emory,MTSU (OPAC),Y,Y,,,Emory copy is bound with three other books
Twelve Negro spiritual songs,"Newton, Ernest",London,F. Pitman Hart,,,1925,Y,1925,,28,31,,,Round,English,Sacred,Y,,,,,,,,,,,,,,,,Y?,,Y,,,Y,,,,Y,,,UK,UK,,,,Y,
Don't leave me Lawd : Negro spiritual,"Reddick, William","New York, NY",G. Ricordi,,,1926,Y,1926,,7,31,,,Round,English,Sacred,,Y,,,,,,,,,,,,,,,Y,,,Y,,Y,,,,Y,,,UK,UK,,,,Y,"Composer from Paducah, KY; have not been able to suss out whether he was black"
My road is rough and rocky all the way,"Pace, Charles Henry",?,Pace Music House,,,1927,Y,1927,,1,26,,,Round,English,Sacred,,Y,,,,,,,,,,,,,,,Y,,,Y,,,,,Y,Y?,,,Chicago Public Library,OCLC,,,,,As sung by the Pace Jubilee Singers
Evangel songs,?,"Springfield, MO",Gospel Publishing House,,,1931,Y,1931,,104 nos.,21,,Assemblies of God,Round,English,Sacred,,Y,,,,,Y,,,,,,Y,,,,Y,,,,,,,,,,,,University of Missouri-Kansas City; Manhattan Christian College; University of Missouri-Columbia; Hannibal-Lagrange University; Southern Nazarene University; The Styberg Library; Southwestern Baptist Theological Seminary; SBTS; Iliff School of Theology; Cincinnati Christian University; Asbury Theological Seminary; Pittsburgh Theological Seminary; Victoria University Library; Weber State University; University of North Carolina at Chapel Hill; Cairn University; Drew University Library; Yale University; Boston University; California Baptist University; Azusa Pacific University; Fuller Theological Seminary; Vanguard University; Northwest University; University of British Columbia,OCLC,,,Y,,
"20 hymns for Jewish worship; for solo and chorus, with accompaniment of the organ","Kitziger, Frederick E.","New Orleans, LA",Kitziger,,,1894,,,,58,30,,Jewish (Reform),Round,English,Sacred,Y,,,,,,,,,,,,,,,,Y,,,,,Y,,,,,,,"Hebrew Union College-JIR, Cincinnati; Jewish Theological Seminary of America; Florida Atlantic University; University of Pennsylvania Libraries",OCLC,,,,,
"223 Melodien deutscher Kirchengesange : meist aus dem 16. und 17. Jahrhundert, in ihren ursprunglichen Rhythmen und Tonen","Layriz, Fr.","St. Louis, MO",?,Verlag von Otto Ernst,,1857,,,3rd ed.,68,18,,,Round,German,Sacred,Y,,,,,,,,,,,,,,,,,,,,,,,,,,,,German Society of Pennsylvania; United Lutheran Seminary,OCLC,,,,,
"225 Melodien deutscher Kirchengesange : meist aus dem 16. und 17. Jahrhundert, in ihren ursprunglichen Rhythmen und Tonen","Layriz, Fr.","St. Louis, MO",M. C. Barthel,,,1865,,,Revised ed.,67,18,,,Round,German,Sacred,Y,,,,,,,,,,,,,,,,,,,,,,,,,,,,Ohio Wesleyan University; Washington University in St. Louis; Concordia Theological Seminary; Luther College; Bethany Lutheran College,OCLC,,,,,
335 Melodien deutscher Kirchengesange : meist aus dem 16. und 17. Jahrhundert,"Layriz, Fr.","St. Louis, MO",Lutherischer Concordia Verlag,,,1887,,,Revised ed.,107,18,,Lutheran (Missouri Synod),Round,German,Sacred,Y,,,,,,,,,,,,,,,,,,,,,,,,,,,,"Concordia Theological Seminary; Valparaiso University; Concordia University Chicago; Wartburg Theological Seminary; Buffalo and Erie County Public Library; Westminster Choir College; Wartburg College; Concordia University Nebraska; Bethany Lutheran College; Concordia University, St. Paul; University of Minnesota, Minneapolis; University of Washington",OCLC,,,,,
