Title,Responsibility,Associated Places,Publication,Manufacture,Distribution,Date,Approximate Date,Copyright,Edition/Imprint,Pagination,Height,Width,Denomination,Notation,Language,Content,1850-1925,After 1925,Before 1850,Broadside,Confederate Imprint,Convention Gospel,Denominational Publication,Dispersed Harmony,Distributor in South,Ethnographic,Female Author/Publisher,Fraternal Society,Gospel,Liturgical/Devotional Content,Missionary Use,Native Use,Non-White,Occasional,Out-of-Country Publisher,Out-of-Region Publisher,Revival Use,Scientific Music,Singing School Use,Still in Use,Sheet Music,Spirituals,Sunday School Use,Tract Society Publication,Attestations,Source for Record,Emory Holdings,MTSU Holdings,SBTS Holdings,UK Holdings,Notes
Voice of thanksgiving no. 3 : edited and compiled by The Moody Bible Institute of Chicago,?,"Chicago, IL",Bible Institute Colportage Association,,,1922,,,Abridged ed.,vols.,20,,,Round,English,Sacred,Y,,,,,,,,Y?,,,,,,,,,,,Y,,,,,,,,Y,Emory,Emory,Y,,,,
When the millions come pouring in,"Reynolds, I. E.","Nashville, TN?",Southern Baptist Convention?,,,191?,Y,,,1,19,,Baptist (SBC)?,Round,English,Sacred,Y,,,,,,Y?,,,,,,,,,,,Y,,,,,,,,,,,SBTS,SBTS,,,Y,,Dedicated to the Baptist 75 million campaign. Sheet music.
"White ribbon hymnal, or, Echoes of the Crusade, The : compiled for the National and World's Woman's Christian Temperance Unions","Gordon, Anna A.","Chicago, IL",Woman's Temperance Publication Association,,,1892,,,,174,23,,,Round,English,Mixed,Y,,,,,,,,Y?,,Y,,,,,,,,,Y,,,,,,,,,MTSU,MTSU (OPAC),,Y,,,
"Wilmington Jubilee Singers, The : a book of songs and music","Liverpool, England",Matthews Bros.,,,,1877,,,,84,18,,,Round,English,Sacred,Y,,,,,,,,,,,,,,,,Y,,Y,,,Y?,,,,Y,,,University of Oxford; The British Library,OCLC,,,,,The Wilmington group was apparently based in the UK
"Windows of heaven : hymns new and old for the church, Sunday school and home, used by Rev. H.M. Wharton, in evangelistic work","Staples, R. G.; Wharton, H. M.","Baltimore, MD",Wharton & Barron,,,1889,,,,208,21,,,Round,English,Sacred,Y,,,,,,,,,,,,Y,,Y,,,,,,,,,,,,,,SBTS; Emory,SBTS,Y,,Y,,
Wonder hymns of faith : a new general-purpose song-book,"Scoville, Charles Reign; Hackleman, W. E. M.; Sturgis, J. E.","Cincinnati, OH",Standard Publishing Company,,,1924,Y,,,282 nos.,20,,,Round,English,Sacred,Y?,,,,,,,,,,,,Y,Y,,,,,,,,,,,,,,,SBTS; MTSU,SBTS,,Y,Y,,"Orchestration for fifteen instruments apparently available, but not included in this ed."
Wonderful love : A service of scripture and song for Easter,"Pitt, Emma","Baltimore, MD",Emma Pitt Pub. Co.,,,1897,Y,,,16,23,,,Round,English,Sacred,Y,,,,,,,,,,Y,,,,,,,,,,,,,,,,,,Emory,Emory,Y,,,,
"Wonderful songs : a collection of familiar hymns designed for evangelistic work, for use in tents, etc.","Pullias, C. M.","Nashville, TN",Gospel Advocate Co.,,,192?,Y,,,62 nos.,21,,,Round,English,Sacred,Y,,,,,,,,,,,,Y,,,,,,,,Y,,,,,,,,UK,UK,,,,Y,Research needed to determine date
"Word fulfilled, The","Clark, F. A.","Philadelphia, PA",Hall-Mack Co.,,,1915,,,,15,22,,,Round,English,Sacred,Y,,,,,,,,,,Y,,,Y,,,Y,,,Y,,,,,,,,,Library of Congress,OCLC,,,,,A complete service for Christmas
Words of truth : a collection of hymns and tunes for Sunday-schools and other occasions of Christian work and worship,"Sewell, E. G.; McIntosh, R. M.; Christie, H. R.","Nashville, TN",Gospel Advocate Pub. Co.,,,1892,Y,,Round note ed.,224,21,,Restorationist,Round,English,Sacred,Y,,,,,,,,,,,,,,,,,,,,,,,,,,Y,,Emory,Emory,Y,,,,
"World wide revival songs : for the church, Sunday school and evangelistic meetings","Curry, C. P.; Rodeheaver, Homer A.; Gabriel, Charles H.; Thomas, John E.","Siloam Springs, AR",Revival Pub. Co.,,,1915,Y,,,300,21,,,Round,English,Sacred,Y,,,,,,,,,,,Y,Y,,,,,,,,,,,,,,,Y,Emory,Emory,Y,,,,Approved and used by the International Federation of Christian Workers.
"World-famous Williams' Colored Singers, The : the world's greatest harmonizing octette",?,"Chicago, IL",Press of Rosenow Co.,,,1904,Y,,,24,28,,,Round,English,Sacred,Y,,,,,,,,,,,,,,,,Y,,,Y,,Y?,,,,Y,,,University of Chicago Library; Brown University,OCLC,,,,,
Worship and camp songs : of the Woman's Home Missionary Society of the Methodist Episcopal Church,?,"Cincinnati, OH",Woman's Home Missionary Society,,,188?,Y,,,46,23,,Methodist (MEC),Round,English,Sacred,Y,,,,,,Y,,,,,,,,,,,,,,,,,,,,,Y,Emory,Emory,Y,,,,
"Young people's hymnal no. 3, The : adapted to the use of Sunday Schools, Epworth Leagues, prayer meetings, and revivals","Atkins, James; Kirkpatrick, William J.","Nashville, TN; Dallas, TX","Pub. House, Methodist Episcopal Church, South",,,1905,,,,224,21,,"Methodist (MEC,S)",Round,English,Sacred,Y,,,,,,Y,,,,,,Y,,,,,,,,Y,,,,,,Y,,MTSU; Emory,MTSU (OPAC),Y,Y,,,
Young people's temperance chorus book,"Gordon, Anna A.","Evanston, IL",National Woman's Christian Temperance Union,,,1911,,,,63,19,,,Round,English,Sacred,Y,,,,,,,,Y?,,Y,,,,,,,,,Y,,,,,,,Y,Y,Emory,Emory,Y,,,,
Zimrath yah,"Goldstein, Morris; Kaiser, Alois; Welsch, Samuel","Baltimore, MD; New York, NY",The Cantors,,,1873-86,,,,4 vols.,27,,Jewish,Round,Hebrew; German; English,Sacred,Y,,,,,,,,,,,,,Y,,,Y,,,Y,,Y?,,,,,,,"Hebrew Union College-JIR, Cincinnati; College of Charleston; Jewish Theological Seminary of America; Southwestern Baptist Theological Seminary; San Francisco Public Library; UC Berkeley; Arizona State University Library; University of California, Los Angeles; Spertus Institute for Jewish Learning; Jewish Theological Seminary of America",OCLC,,,,,Only HUC lists all four volumes held; most have only vols. 1-3
Zions Glaubensstimme : Gesangbuch der Mennoniten Brudergemeinde in Nordamerika,"Grage, H. W.","Medford, OK",Mennonite Brethren Pub. House,,,1905,,,,524,19,,Mennonite,Round,German,Sacred,Y,,,,,,Y,,,,,,,,,,,,,,,,,,,,,,Eastern Mennonite University; Mennonite Historical Library; Tabor College,OCLC,,,,,
  Zemirot Yirael = Jewish hymns for Sabbath-schools and families (English and German),"Hecht, Simon","Cincinnati, OH",Bloch & Co.,,,1878,,,2nd ed.,55,19,13,Jewish,Round,German; English,Sacred,Y,,,,,,,,,,,,,,,,Y,,,,,,,,,,Y,,Leo Baeck Institute,OCLC,,,,,
  = O Day of God : English text,"Kaiser, Alois; Sparger, William; Klein, Max D.","Baltimore, MD; Chicago, IL; Philadelphia, PA; New York, NY",Bloch Pub. Co.,,,1893,Y,,,4,28,,Jewish,Round,English,Sacred,Y,,,,,,,,,,Y?,Y,,,,,Y,Y,,Y,,Y?,,,,,,,Jewish Theological Seminary of America,OCLC,,,,,"This arrangement is from the 'Songs of Zion' compiled by Cantors Alois Kaiser and William Sparger as a souvenir of the Jewish Women's Congress held during the World's Fair in Chicago, 1893. Interior text in English only."
  : Home-service for Passover eve / Seder Hagadah : home-service for Passover eve,"Rosenau, William; Kaiser, Alois","Baltimore, MD; New York, NY",Bloch Pub. Co.,,,1905,,,,168,18,,Jewish (Reform),Round,Hebrew; English,Sacred,Y,,,,,,,,,,,,,Y,,,Y,,,Y,,,,,,,,,"Hebrew Union College-JIR, Cincinnati; John Carroll University; Library of Congress; Johns Hopkins University; University of Ontario; University of Rochester; Colgate Rochester Crozer Divinity School; University of Florida; Jewish Theological Seminary of America; Yeshiva University; Yale University; University of Nebraska-Lincoln; Harvard College; University of Texas",OCLC,,,,,
  : Home-service for Passover eve / Seder Hagadah : home-service for Passover eve,"Rosenau, William; Kaiser, Alois","Baltimore, MD; New York, NY",Bloch Pub. Co.,,,1913,,,4th revised ed.,171,18,,Jewish (Reform),Round,Hebrew; English,Sacred,Y,,,,,,,,,,,,,Y,,,Y,,,Y,,,,,,,,,"Hebrew Union College-JIR, Cincinnati; Jewish Theological Seminary of America",OCLC,,,,,
  : Home-service for Passover eve / Seder Hagadah : home-service for Passover eve,"Rosenau, William; Kaiser, Alois","Baltimore, MD; New York, NY",Bloch Pub. Co.,,,1916,,,5th ed. revised,171,19,,Jewish (Reform),Round,Hebrew; English,Sacred,Y,,,,,,,,,,,,,Y,,,Y,,,Y,,,,,,,,,George Washington University; University of Toronto at Downsview; American Jewish Historical Society New York; New YOrk Public Library System; Jewish Theological SEminary of America; Gordon-Conwell Theological SEminary,OCLC,,,,,
  : Home-service for Passover eve / Seder Hagadah : home-service for Passover eve,"Rosenau, William; Kaiser, Alois","Baltimore, MD; New York, NY",Bloch Pub. Co.,,,1918,,,6th ed.,171,18,,Jewish (Reform),Round,Hebrew; English,Sacred,Y,,,,,,,,,,,,,Y,,,Y,,,Y,,,,,,,,,Harvard College; Stanford University,OCLC,,,,,
  : Home-service for Passover eve / Seder Hagadah : home-service for Passover eve,"Rosenau, William; Kaiser, Alois","Baltimore, MD; New York, NY",Bloch Pub. Co.,,,1920,,,7th ed.,"2, 171",19,,Jewish (Reform),Round,Hebrew; English,Sacred,Y,,,,,,,,,,,,,Y,,,Y,,,Y,,,,,,,,,Jewish Theological Seminary of America; Tulane University,OCLC,,,,,
  : Home-service for Passover eve / Seder Hagadah : home-service for Passover eve,"Rosenau, William; Kaiser, Alois","Baltimore, MD; New York, NY",Bloch Pub. Co.,,,1922,,,8th ed.,171,18,,Jewish (Reform),Round,Hebrew; English,Sacred,Y,,,,,,,,,,,,,Y,,,Y,,,Y,,,,,,,,,Jewish Theological Seminary of America,OCLC,,,,,
  : Home-service for Passover eve / Seder Hagadah : home-service for Passover eve,"Rosenau, William; Kaiser, Alois","Baltimore, MD; New York, NY",Bloch,,,1924,,,9th ed.,171,?,,Jewish (Reform),Round,Hebrew; English,Sacred,Y,,,,,,,,,,,,,Y,,,Y,,,Y,,,,,,,,,Harvard College,OCLC,,,,,
  = The Synagogue service / Avodat ha-kodesh = The Synagogue service,"Jacobs, Henry S.","New York, NY; Baltimore, MD",Congregation B'nai Jeshurun of New York?,Press of I. Friedenwald,,1889,,,,4 vols.,19,,Jewish (Orthodox?),Round,Hebrew,Sacred,Y,,,,,,Y,,Y,,,,,,,,Y,,,Y,,,,,,,,,University of Denver; Hebrew Union College-JIR; Jewish Theological Seminary of America; New York Public Library System; Brandeis University; University of Alberta,OCLC,,,,,"Hard to keep track of B'nai Jeshurun's affiliation, but it looks like this was probably a modified version of the Reform siddur they had previously collaborated on with several other New York City congregations but which they only adopted after the turn back towards orthodoxy"
"  Shire Yisrael : Adon olam = Sherai Israel : a collection of sacred music, psalms and hymns, with accompaniment for the organ, adapted for public worship : Sovereign Lord","Goldstein, Morris","Cincinnati, OH",Bloch & Co.,,,1895,Y,,,13,28,,Jewish (Reform),Round,Hebrew; English,Sacred,Y,,,,,,,,,,,,,,,,Y,,,,,Y,,,,,,,"Hebrew Union College-JIR, Cincinnati; Jewish Theological Seminary of America",OCLC,,,,,
"  = Shirai tehilloh : a collection of sacred music, Psalms and hymns, with accompaniment for the organ.",?,"Cincinnati, OH",Bloch,,,1892,,,,76,31,,Jewish,Round,Hebrew,Sacred,Y,,,,,,,,,,,,,,,,Y,,,,,Y?,,,,,,,SBTS,SBTS,,,Y,,
"Hymnist, The : heart hymns and home melodies","Hayden, A. S.","Cincinnati, OH",H. S. Bosworth,,,1860,Y,1860,"3rd ed., revised and enlarged",160,15,,,Round?,English,Sacred,Y,,,,,,,,,,,,,,,,,,,,,,,,,,,,Emory,Emory,Y,,,,
Melodies of heaven : a collection of hymns and tunes for social worship : for the use of Universalist and other liberal Christian churches,"St. John, Thomas Eliot","Cincinnati, OH",Williamson & Cantwell,,,1874,,1868,,112,17,,"Universalist ""and other liberal denominations""",Round?,English,Sacred,Y,,,,,,Y,,,,,,,,,,,,,,,,,,,,,,MTSU,MTSU (OPAC),,Y,,,"In both local and public catalogs, so probably two copies, possibly two editions"
"New Baptist song and tune book, for churches and Sunday schools, The","Graves, J. R.","Memphis, TN",Southern Baptist Publication Society,,,1873,Y,1873,,324,17,,Baptist (SBC),Round?,English,Sacred,Y,,,,,,Y,,,,,,,,,,,,,,,,,,,,,,SBTS,SBTS,,,Y,,"SBTS copy bound with Graves's ""The Little Seraph"""
"Hours of song : a book of rudiments and a collection of new music, sacred and secular, for singing classes and conventions","Fillmore, J. H.","Cincinnati, OH",Fillmore Bros.,,,1875,Y,1875,,111,17,24,,Round?,English,Mixed,Y,,,,,,,,,,,,,,,,,,,,,,Y,,,,,,MTSU,MTSU (OPAC),,Y,,,
"New hymn and tune book, The : a collection of hymns and tunes for public, social, and domestic worship",?,"Nashville, TN",Southern Methodist Publishing House,,,1883,,1880,,192,20,,"Methodist (MEC,S)",Round?,English,Sacred,Y,,,,,,Y,,,,,,,,,,,,,,,,,,,,,,Emory,Emory,Y,,,,
"New hymn and tune book, The : a collection of hymns and tunes for public, social, and domestic worship",?,"Nashville, TN",Southern Methodist Publishing House,,,1885,,1880,,192,20,,"Methodist (MEC,S)",Round?,English,Sacred,Y,,,,,,Y,,,,,,,,,,,,,,,,,,,,,,Emory,Emory,Y,,,,
Songs of glory no. 2 : a collection of beautiful songs for Sunday schools and the family circle,"Fillmore, J. H.","Cincinnati, OH",Fillmore Bros.,,,1887,,1881,,"127, 1",15,18,,Round?,English,Sacred,Y,,,,,,,,,,,,Y,,,,,,,,,,,,,,Y,,Emory,Emory,Y,,Y,,
Songs of redeeming love,"Sweney, John R.","Cincinnati, OH; St. Louis, MO; Chicago, IL; Philadelphia, PA",Cranston & Stowe,,,1882,Y,1882,,160,?,,,Round?,English,Sacred,Y,,,,,,,,Y,,,,Y,,,,,,,,,,,,,,,,MTSU,MTSU (OPAC),,Y,,,
"Voice of joy, The : a collection of new songs for the Sunday-school","Rosecrans, J. H.","Cincinnati, OH",Fillmore Bros.,,,1883,,1882,,160,14,18,,Round?,English,Sacred,Y,,,,,,,,,,,,,,,,,,,,,,,,,,Y,,Emory; MTSU?,Emory,Y,Y,,,
"Voice of joy, The : a collection of new songs for the Sunday-school","Rosecrans, J. H.","Cincinnati, OH",Fillmore Bros.,,,1884,,1882,,160,15,18,,Round?,English,Sacred,Y,,,,,,,,,,,,,,,,,,,,,,,,,,Y,,MTSU; Emory,MTSU (OPAC),Y,Y,,,
Holy voices : for the Sunday school and other services of the church,"Lorenz, Edmund S.; Baltzell, Isaiah","Dayton, OH",W. J. Shuey,,,1883,Y,1883,,192,14,18,,Round?,English,Sacred,Y,,,,,,,,,,,,,,,,,,,,,,,,,,Y,,Emory,Emory,Y,,,,
"Prayer and praise, or, hymns and tunes for prayer meetings, praise meetings, experience meetings, revivals, missionary meetings, and all special occasions of Christian work and worship","Haygood, Atticus G.; McIntosh, R. M.","Nashville, TN","Publishing House of the M. E. Church, South","J. D. Barbee, agent",,1883,,1883,,320,21,,"Methodist (MEC,S)",Round?,English,Sacred,Y,,,,,,Y,,,,,,Y,,Y,,,,,,Y,,,,,,,,Emory,Emory,Y,,,,
"Beauty of praise, The : for Sunday schools","Pollock, Charles Edward","Cincinnati, OH",G. W. Gale,,,1884,Y,1884,,143,13,17,,Round?,English,Sacred,Y,,,,,,,,,,,,,,,,,,,,,,,,,,Y,,Emory,Emory,Y,,,,
"Gospel music : a choice collection of hymns and melodies new and old for Gospel, revival, prayer and social meetings, family worship, etc.","Lowry, Robert; Doane, W. Howard","Cincinnati, OH",G. D. Newhall,,,1884,Y,1884,,112,21,,,Round?,English,Sacred,Y,,,,,,,,,,,,Y,,,,,,,,Y,,,,,,Y,,Emory,Emory,Y,,,,
Grateful praise : a collection of new songs for the Sunday-school,"Fillmore, J. H.","Cincinnati, OH",Fillmore Bros.,,,1884,Y,1884,,160,14,18,,Round?,English,Sacred,Y,,,,,,,,,,,,Y,,,,,,,,,,,,,,Y,,MTSU; SBTS; Emory,MTSU (OPAC),Y,Y,Y,,
Jesus of Nazareth in prophecy and fulfillment : a Bible exercise,"Errett, Russell; Fillmore, James H.","Cincinnati, OH; New York, NY",Fillmore Bros.,,,1884,Y,1884,Revised ed.,18,24,,,Round?,English,Sacred,Y,,,,,,,,,,,,,,,,,,,,,Y?,,,,,,,Emory,Emory,Y,,,,
"Holy manna : or, Hymns and tunes for revivals, prayer and praise meetings, the Sabbath school, etc.","Dortch, D. E.","Columbia, TN",Dortch & Wilkes,,,1885,Y,1885,,32,22,,,Round?,English,Sacred,Y,,,,,,,,,,,,,,,,,,,,Y,,,,,,Y,,Emory,Emory,Y,,,,
Notes of victory for Sunday schools...,"Ogden, W. A.; Lorenz, E. S.","Dayton, OH",United Brethren Pub. Co.,,,1885,Y,1885,,192,14,18,Brethren,Round?,English,Sacred,Y,,,,,,,,,,,,,Y,,,,,,,,,,,,,Y,,MTSU,MTSU (OPAC),,Y,,,
"Children's hallelujah, The : a collection of new songs for the Sunday-school","Rosecrans, J. H.; Fillmore, J. H.","Cincinnati, OH",Fillmore Bros.,,,1886,Y,1886,,178,14,18,,Round?,English,Sacred,Y,,,,,,,,,,,,,,,,,,,,,,,,,,Y,,Emory,Emory,Y,,,,
"Gospel voices : a choice collection of songs and tunes for the Sunday school and gospel meetings ; entirely new and never before published, with the exception of a few standard tunes ; the responsive services are a special feature of the work and will be appreciated by Sunday School workers","Davis, Frank M.; Pound, E. T.","Barnesville, GA",E. T. Pound,,,1886,Y,1886,,288,21,,,Round?,English,Sacred,Y,,,,,,,,,,,,Y,,,,,,,,,,,,,,Y,,Emory,Emory,Y,,,,
"Gospel voices : a choice collection of songs and tunes for the Sunday school and gospel meetings : entirely new and never before published, with the exception of a few standard tunes : the responsive services are a special feature of the work and will be appreciated by Sunday school workers","Davis, Frank M.; Pound, E. T.","Barnesville, GA",E. T. Pound,,,1886,Y,1886,,446,21,,,Round?,English,Sacred,Y,,,,,,,,,,,,Y,,,,,,,,Y,,,,,,Y,,SBTS,SBTS,,,Y,,
"Holy manna : or, Hymns and tunes for revivals, prayer and praise meetings, the Sabbath school, etc. no. 2","Dortch, D. E.","Columbia, TN",D. E. Dortch,,,1887,Y,1887,,29,22,,,Round?,English,Sacred,Y,,,,,Y?,,,,,,,,,,,,,,,Y,,,,,,Y,,Emory,Emory,Y,,,,"On cover: ""Brethren, pray, and holy manna will be showered all around, No. 2, by D. E. Dortch"""
"New Christian hymn and tune-book, part III : a selection of hymns and tunes for Christian worship.",?,"Cincinnati, OH","Fillmore, Bros.",,,1887,Y,1887,,448,19,,Restorationist,Round?,English,Sacred,Y,,,,,,Y?,,,,,,,,,,,,,,,,,,,,,,UK; Emory,UK,Y,,,Y,UK copy may be incomplete
Popular hymns for church and Sunday-school,"Cline, C. C.; Melven, T. L.","Louisville, KY",?,Courier-Journal,,1880,,1887,5th ed.,199,14,,Restorationist,Round?,English,Sacred,Y,,,,,,,,,,,,,,,,,,,,,,,,,,Y,,UK,UK,,,,Y,
Deutsches Gesang und Melodienbuch der bischoflichen Methodisten-Kirche,?,"Cincinnati, OH; Chicago, IL; Kansas City, MO; San Francisco, CA; New York, NY; Boston, MA; Pittsburgh, PA; Detroit, MI",Methodist Book Concern,,,1896,,1888,,"447, 8",22,,Methodist (MEC?),Round?,German,Sacred,Y,,,,,,Y,,,,,,,,,,,,,,,,,,,,,,Colegate Rochester Crozer Divinity School; Martin Luther College; Southern Methodist University; Iliff School of Theology,OCLC,,,,,
"Favorite hymns : a collection of church and Sunday-school songs for religious conventions, institutes, and protracted meetings","Hopkins, Alex G.","Cincinnati, OH",Fillmore Bros. Publishers,,,1888,Y,1888,,64,14,18,,Round?,English,Sacred,Y,,,,,,,,,,,,,,,,,,,,Y,,,,,,,,SBTS,SBTS,,,Y,,
Songs of rejoicing : a collection of new songs for the Sunday-school,"Fillmore, Fred A.","Cincinnati, OH",Fillmore Bros.,,,1888,Y,1888,,160,15,18,,Round?,English,Sacred,Y,,,,,,,,,,,,,,,,,,,,,,Y?,,,,Y,,MTSU; Emory,MTSU (OPAC),Y,Y,,,
"Easter bells : a service for Sunday-Schools, consisting of carols, readings, and recitations","Fillmore, J. M.","Cincinnati, OH",Fillmore Bros.,,,1889,Y,1889,,16,20,,,Round?,English,Sacred,Y,,,,,,,,,,,,,,,,,,,,,,,,,,,,Emory,Emory,Y,,,,
"Voice of praise, The : a new collection of beautiful and appropriate hymns, tunes and gospel songs for Sunday-schools and gospel meetings","Showalter, A. J.; Lewis, H. A.; Hoffman, E. A.","Dalton, GA",A. J. Showalter,,,1889,Y,1889,,176,21,,,Round?,English,Sacred,Y,,,,,,,,,,,,Y,,,,,,,,,,,,,,Y,,UK; Emory,UK,Y,,,Y,
Christian work-songs : for use in protracted meetings and other religious services,"Rosecrans, J. H.","Cincinnati, OH; New York, NY",Fillmore Bros.,,,1890,Y,1890,,160,20,,,Round?,English,Sacred,Y,,,,,,,,,,,,,,,,,,,,Y,,,,,,,,Emory,Emory,Y,,,,
Fillmore's women's choir nos. 1 and 2 combined : a collection of new gospel songs for female quartets and choruses,"Gabriel, Charles H.","Cincinnati, OH",Fillmore Brothers,,,1890,Y,1890,,96,19,,,Round?,English,Sacred,Y,,,,,,,,,,,,Y,,,,,,,,,,,,,,,,Emory,Emory,Y,,,,
Gems and jewels : a collection of new songs for the Sunday-school,"Fillmore, J. H.; Rosecrans, J. H.","Cincinnati, OH",Fillmore Bros.,,,1890,Y,1890,,160,14,18,,Round?,English,Sacred,Y,,,,,,,,,,,,Y,,,,,,,,,,,,,,Y,,MTSU; SBTS; UK,MTSU (OPAC),,Y,Y,Y,UK copy lacks title page
"Notes of praise : a collection of choice original hymns and tunes, by our best composers, for the Sunday-school, devotional, and praise meetings, especially adapted to the International Sunday-school lessons","Davis, Frank M.","Vicksburg, MS",Frank M. Davis,,,1892,,1890,,176,16,19,,Round?,English,Sacred,Y,,,,,,,,,,,,,,,,,,,,Y,,,,,,Y,,Emory,Emory,Y,,,,
"Revival, The : suitable for all kinds of religious meetings","Tillman, Charlie D.","Atlanta, GA",C. D. Tillman,,,1890,Y,1890,Revised ed.,142 nos.,20,,,Round?,English,Sacred,Y,,,,,,,,,,,,,,,,,,,,Y,,,,,,,,Emory; MTSU?,Emory,Y,Y,,,
"Singer's ideal, The : a new choice collection of glees, quartets, part-songs, hymn-tunes, gospel songs, anthems, and oratorio choruses ... together with new rudiments of music, for use in singing-schools, conventions, high schools, normal institutes and musical societies","Showalter, A. J.; Roberts, Edward","Dalton, GA",A. J. Showalter Co.,,,1890,Y,1890,,222,18,25,,Round?,English,Mixed,Y,,,,,Y?,,,,,,,Y,,,,,,,,,,Y,,,,,,MTSU; Emory,MTSU (OPAC),Y,Y,,,
Billows of song,"Creasinger, S. P.","Cincinnati, OH",S. P. Creasinger,,,1893,,1891,,181,21,,,Round?,English,Sacred,Y,,,,,,,,,,,,Y,,,,,,,,,,,,,,,,Emory,Emory,Y,,,,
"Perennial songs : a new collection of hymns, tunes, and gospel songs, for Sunday schools, Christian endeavor societies, Epworth leagues, prayer and gospel meetings, and all other occasions of Christian work and worship","Showalter, A. J.; Roberts, Edward","Dalton, GA",A. J. Showalter,,,1891,Y,1891,,212,19,,Methodist?,Round?,English,Sacred,Y,,,,,,,,,,,,Y,,,,,,,,,,,,,,Y,,UK,UK,,,,Y,
"Revival, The : a collection of songs, suitable for all kinds of religious meetings","Tillman, Charlie D.","Williston, SC",Charlie D. Tillman,,,1891,Y,1891,,142,20,,,Round?,English,Sacred,Y,,,,,,,,,,,,,,Y,,,,,,Y,,,,,,,,Emory; MTSU?,Emory,Y,Y,,,"Used by evangelists J. B. Culpepper, M. B. Williams, and many others in their meetings"
"Gabriel's vineyard songs : for Sunday-schools praise meetings, home circle, and all occasions of church service","Gabriel, Charles H.","Louisville, KY",?,Guide Print. & Pub. Co.,,1892,Y,1892,,199,20,,,Round?,English,Sacred,Y,,,,,,,,,,,,,,,,,,,,,,,,,,Y,,MTSU; SBTS; Emory,MTSU (OPAC),Y,Y,Y,,Emory record lists 196 pp.
"Tried and true : songs for the Sunday-school, praise and devotional meetings","Lorenz, Edmund S.","Dayton, OH",Lorenz Publishing Co.,,,1892,Y,1892,,192,15,19,,Round?,English,Sacred,Y,,,,,,,,,,,,Y,,,,,,,,,,,,,,Y,,MTSU,MTSU (OPAC),,Y,,,
Heart songs : new collection for Sunday schools,"Fillmore, Fred A.","Cincinnati, OH",Fillmore Bros.,,,1893,Y,1893,,192,14,18,,Round?,English,Sacred,Y,,,,,,,,,,,,,,,,,,,,,,,,,,Y,,MTSU; Emory,MTSU (OPAC),Y,Y,,,
"Life and light : a collection of choice songs for gospel meetings, prayer meetings, Sunday schools, etc., etc.","Fogg, Edw. S.; Barker, T. W.","Cincinnati, OH; New York, NY",Fillmore Bros.,,,1893,Y,1893,,"63, 1",20,,,Round?,English,Sacred,Y,,,,,,,,,,,,Y,,,,,,,,Y,,,,,,Y,,Emory,Emory,Y,,,,
"Crowning day, The : a varied collection of sacred songs for all occasions especially for evangelistic work, for the sabbath-school, and the prayer-meeting","Ruebush, J. H.","Dayton, VA",Ruebush-Kieffer Co.,,,1894,Y,1894,,255,22,,,Round?,English,Sacred,Y,,,,,,,,,,,,Y,,,,,,,,Y,,,,,,Y,,MTSU; UK,MTSU (OPAC),,Y,,,
"Carolina harmony : a book of new tunes especially adapted to the hymns for which they were composed, with concise rudiments","Leonard, J. S.","Statesville, NC",J. S. Leonard,,,1895,Y,1895,,133,23,,,Round?,English,Sacred,Y,,,,,,,,,,,,,,,,,,,,,,Y,,,,,,Emory,Emory,Y,,,,
"Salvation songs : for gospel meetings, endeavor societies, Epworth leagues, Baptist unions, Sunday schools and prayer meetings","Gabriel, Charles H.","Cincinnati, OH",Fillmore Bros.,,,1895,Y,1895,,224,21,,Methodist?,Round?,English,Sacred,Y,,,,,,,,,,,,Y,,,,,,,,Y,,,,,,Y,,MTSU; UK; Emory,MTSU (OPAC),Y,Y,,Y,
Voice of praise : a collection of new songs for gospel meetings and Sunday schools,"Daugherty, Leonard","Nashville, TN; Salem, KY",Gospel Advocate,,,1895,Y,1895,,134,21,,Restorationist?,Round?,English,Sacred,Y,,,,,,,,,,,,Y,,,,,,,,Y,,,,,,Y,,UK; SBTS; Emory,UK,Y,,Y,Y,"UK copy provenance Christian Church, Salem KY"
Fillmores' male choir : a collection of new gospel songs for male quartets and choruses,"Fillmore, Fred A.; Lyon, Finley; Fillmore, J. H.","Cincinnati, OH",Fillmore Brothers,,,1896,Y,1896,,48,21,,,Round?,English,Sacred,Y,,,,,Y,,,,,,,Y,,,,,,,,,,,,,,,,Emory,Emory,Y,,,,
"Sunlight songs : a choice collection of new and popular gospel songs, for Sunday schools, Christian endeavor societies, Epworth leagues, young people's unions, prayer and gospel meetings, and all other occasions of Christian work and worship","Showalter, A. J.; Roberts, Edward; Lincoln, H. N.","Dalton, GA",A. J. Showalter Co.,,,1896,Y,1896,,approx. 200,19,,,Round?,English,Sacred,Y,,,,,,,,,,,,Y,,,,,,,,,,,,,,,,SBTS; MTSU; Emory,MTSU (OPAC),Y,Y,,,MTSU copy imperfect (lacks covers)
Fillmores' male choir nos. 1 and 2 : a collection of new gospel songs for male quartets and choruses,"Fillmore, Fred A.; Lyon, Finley; Fillmore, J. H.","Cincinnati, OH",Fillmore Bros.,,,1897,Y,1897,,94,19,,,Round?,English,Sacred,Y,,,,,Y,,,,,,,Y,,,,,,,,,,,,,,,,Emory; MTSU?,Emory,Y,Y,,,
"Song-land melodies : a new song book for revivals, praise and prayer meetings, singing and Sunday schools, and churches, normals, conventions, school and home","Lincoln, H. N.","Dallas, TX; Cincinnati, OH",The Song-Land Company,,,1897,Y,1897,,"190, 93",20,,,Round?,English,Sacred,Y,,,,,Y,,,,,,,,,,,,,,,Y,,Y,,,,Y,,Emory,Emory,Y,,,,"Unclear if this is round note ed. or not, but for some reason it's on a separate record from the other Emory copy"
"Tears and triumphs combined : for revivals, Sunday-schools and the home","Pickett, L. L.; Bryant, John R.; Knapp, Martin Wells","Louisville, KY",Pickett,,,1897,Y,1897,,200,21,,Pentecostal?,Round?,English,Sacred,Y,,,,,,,,,,,,Y,,,,,,,,Y,,,,,,Y,,SBTS,SBTS,,,Y,,
